{"admission_limits":{"artifact_bytes":17179869184,"field_bytes":65536,"record_bytes":1048576},"artifacts":[{"bytes":232,"format":"csv4.gz","multi_pair":true,"name":"corpus.csv.gz","pair":null,"sha256":"2c47e8239cd6449fb4a75da39c08b62096630f4360af142da4af929f991643f4"}],"exceptions":[],"expected_pairs":[{"from":"en-us","to":"uk-ua"},{"from":"sr-rs","to":"sr-rs"},{"from":"sr-sp","to":"sr-rs"},{"from":"uk-ua","to":"en-us"}],"known_gaps":[],"locales":["en-us","sr-rs","sr-sp","uk-ua"],"mapping_version":"identity-v1","normalization_version":"nfc-fold-nfc-v1;xtext=0.43.0;nfc=15.0.0;fold=15.0.0;trim=whitespace-15.0","parser_version":"lossless-csv4-v1","schema_version":1,"source":{"authority":"synthetic","kind":"csv_snapshot","rights_status":"owner_confirmed","snapshot_date":"unknown"}}